{
  "id": "builtin.pixcc",
  "name": "次元画册",
  "version": "0.1.0",
  "apiVersion": 1,
  "minAppVersion": "1.0.0",
  "description": "pixcc.net 插画与 Cosplay 专辑，支持搜索、标签与榜单。",
  "author": "Iriso",
  "homepage": "https://www.pixcc.net/",
  "languages": [
    "zh"
  ],
  "capabilities": [
    "featured",
    "search",
    "album",
    "tag"
  ],
  "runtime": {
    "type": "sandbox",
    "baseUrl": "https://www.pixcc.net/",
    "hosts": [
      "www.pixcc.net",
      "pixcc.net"
    ],
    "script": "script.js",
    "sha256": "147ba22e5da9f5404beeb0d229380f73b03600f851a7ff3c06948cdce73f9f42"
  },
  "settings": [],
  "changelog": [],
  "source": {
    "repo": null,
    "commit": "7ab6d8289bd7bc9f67a13eabe20743abeab4a88a"
  }
}
